[
  {
    "name": "Inspirational Quotes",
    "description": "Your dose of inspiration.",
    "updatedAt": 1735428000,
    "filename": "quotes.json",
    "randomize": true
  },
  {
    "name": "Top Headlines (US)",
    "description": "Latest headlines from NewsAPI for US",
    "updatedAt": 1793351062,
    "filename": "top-headlines-us.json"
  },
  {
    "name": "Tang Shi 300",
    "description": "Three Hundred Tang Poems",
    "updatedAt": 1766977924,
    "filename": "tang-shi.json",
    "randomize": true
  }
]